{
  "client_name": "鳳凰 AI 顧問團隊",
  "client_badge": "DINGSHENG GROUP",
  "logo_text": "PHOENIX AI 顧問 x [鳳凰 AI 顧問團隊]",
  "output_dir": "slides/dingsheng",
  "theme": "obsidian-midnight",
  "audience": "internal",
  "min_slides_required": 9,
  "slides": [
    {
      "page": "01",
      "layout": "cover",
      "progress_label": "COVER",
      "title": "把南部廠的黑手實力，升級成安全的 AI 戰力",
      "subtitle": "為 [董事長暨執行長 閣下] 與鼎盛精密專案小組客製｜不動核心、解放雙手、用補助買單",
      "speaker_notes": "【開場白】董事長、各位主管午安。今天不談神經網路，只談三件事——怎麼不再燒錢死在 POC、怎麼讓滿手油的師傅也能用 AI、怎麼用政府的錢做轉型。【互動提示】開場問：『過去導入 AI，最痛的一次是死在哪個環節？』讓 CEO 點出痛點，後面對症下藥。【顧問口訣】先讀懂廠房，再談技術。",
      "version": "v2026.06.01",
      "date": "2026-05-29"
    },
    {
      "page": "02",
      "layout": "dual-track",
      "progress_label": "M01",
      "title": "雙軌落地戰略：總部安控 × 一線賦能",
      "subtitle": "降低變革阻力，讓師傅與 CIO 都點頭",
      "speaker_notes": "【講述重點】左軌給 CIO/財務長（不動核心、控成本、過稽核），右軌給廠長（師傅好用）。【互動提示】問 CIO：『您評估 AI 最大的顧慮是不是怕動到 ERP？』正好帶到唯讀串接設計。【顧問口訣】左手守機密，右手解油手，兩手都要硬。",
      "badge_left": "戰略防線",
      "title_left": "總部安控軌",
      "content_left": "• DLP 遮罩，機密進不了外部 AI<br>• ISO 42001 + 審計軌跡備外銷稽核<br>• ERP/CRM 唯讀串接，不動核心<br>• 單月財務告警閾值控 TCO",
      "badge_right": "實務落地",
      "title_right": "一線賦能軌",
      "content_right": "• Voice AI 解放滿手油的雙手<br>• 複誦確認，送出前人眼把關<br>• 邊緣離線，斷網不停線<br>• AI Champion 帶動現場採用"
    },
    {
      "page": "03",
      "layout": "dual-track",
      "progress_label": "M02",
      "title": "跨越 POC 死亡谷：4+1 戰略畫布與財務精算",
      "subtitle": "用一張 A3 紙，過濾掉沒 ROI 的偽需求",
      "speaker_notes": "【講述重點】這張直擊 CEO 第一痛（POC 死亡谷、怕燒錢）。【關鍵】POC 死因不是技術，是一開始選錯場景。【互動提示】問財務長：『過去的 AI 嘗試，當初是誰、用什麼標準選的場景？』帶出畫布的價值。【顧問口訣】選錯場景，技術再強也白燒。",
      "badge_left": "選對場景",
      "title_left": "畫布",
      "content_left": "• A3 紙 90 分鐘跨部門共識<br>• 價值×數據就緒×阻力三維篩網<br>• 過濾『很炫但沒 ROI』偽需求<br>• 只留 90 天 Quick-Win 真場景",
      "badge_right": "算對帳",
      "title_right": "財務",
      "content_right": "• Buy vs Build vs Rent 量化決策<br>• 製造業 99% 該 Rent/Buy<br>• 自訓模型＝TCO 無底洞<br>• Token 網閘＋單月告警控成本"
    },
    {
      "page": "04",
      "layout": "dual-track",
      "progress_label": "M03",
      "title": "Voice AI 解放雙手：滿手油也能用的有感 AI",
      "subtitle": "Realtime API 串流語音＋複誦確認回路",
      "speaker_notes": "【講述重點】全場師傅最有感的一張，這是 CEO 親口點的痛。【關鍵】這才是『有感 AI』，不是辦公室工程師憑空想像的系統。【互動提示】現場可演示戴手套語音報修。問廠長：『師傅停機去打字，一次耽誤多少產能？』【顧問口訣】讓 AI 遷就師傅，不是讓師傅遷就 AI。",
      "badge_left": "戰略防線",
      "title_left": "解放雙手",
      "content_left": "• 戴手套滿手油也能用嘴操作<br>• 報工/報修/查工單/調規格<br>• 不停機、不脫手套<br>• Realtime API 邊講邊出字",
      "badge_right": "實務落地",
      "title_right": "用得安全",
      "content_right": "• 複誦確認，送出前人眼把關<br>• 製程工法語音字典提升辨識率<br>• 邊緣離線可用，斷網不停線<br>• 關鍵指令一律走確認回路"
    },
    {
      "page": "05",
      "layout": "dual-track",
      "progress_label": "M04",
      "title": "機密地端隔離與 ERP/CRM 不動核心串接",
      "subtitle": "守住機密、不動您花十年建的系統",
      "speaker_notes": "【講述重點】這張同時回應 CEO 的資安恐懼與優化建議一（ERP/CRM 串接），給 CIO 與法務。【關鍵】不碰您花十年建的 ERP，只在外面加唯讀、可稽核的 AI。【互動提示】問 CIO：『若 AI 直接寫進 ERP 出錯，誰扛？』帶出唯讀＋中介層的價值。【顧問口訣】出事了，ERP 永遠是乾淨的。",
      "badge_left": "守機密",
      "title_left": "DLP",
      "content_left": "• 機密進外部 AI 前代號化遮罩<br>• 白名單出口，預設禁外傳<br>• ISO 42001 + 審計軌跡備稽核<br>• 外銷客戶供應商稽核通行證",
      "badge_right": "不動核心",
      "title_right": "串接",
      "content_right": "• ERP/CRM 唯讀 API，不寫不改<br>• 中介層緩衝，寫回需人工確認<br>• 輕量 Agent 補彈性查詢<br>• 標準 API，換供應商不被綁"
    },
    {
      "page": "06",
      "layout": "dual-track",
      "progress_label": "M05",
      "title": "變革管理：消除取代恐懼與 AI Champion 選拔",
      "subtitle": "M10 五部曲＋種子選拔指標，把阻力化拉力",
      "speaker_notes": "【講述重點】這張回應 CEO 核心價值三與優化建議二（Champion 指標），給 HR。【關鍵】選對 Champion 勝過十場宣導會；被指派的 Champion 必敗。【互動提示】問 HR：『各部門誰是那個同事都服、又願意先試的人？』當場點名候選。【顧問口訣】選人比選工具更重要。",
      "badge_left": "戰略防線",
      "title_left": "變革五部曲",
      "content_left": "• 共情：承認轉型壓力真實<br>• 賦能＋考核加分綁定<br>• 省下時間做高價值工法傳承<br>• 見效表揚→種子擴散",
      "badge_right": "AI",
      "title_right": "Champion 選拔（5維",
      "content_right": "• 影響力：非主管但有威望<br>• 學習力＋韌性扛同儕質疑<br>• 溝通力：把 AI 講成大白話<br>• 意願：自願報名非指派"
    },
    {
      "page": "07",
      "layout": "interactive-roi",
      "progress_label": "ROI",
      "title": "ROI 互動模擬：釋放的工時，回收多少利潤？",
      "subtitle": "拖動滑桿，即時計算機會成本與利潤回收",
      "speaker_notes": "【講述重點】全場高潮，務必現場拉滑桿。【操作】先停保守 10%(回收900萬)建立可信，再拉到預設 40%(3,600萬)製造張力。【務必聲明】這是產能釋放非裁員；最大獎金是滑桿『算不進去』的避免燒錢、避免外洩、保住外銷單。【互動提示】問財務長：『我們報工、查報表、排程的隱性工時，加起來有沒有四成？』【顧問口訣】省下的看得見，避免的更值錢。",
      "slider_min": 10,
      "slider_max": 60,
      "slider_default": 40,
      "cost_base": 1800000,
      "num_workers": 50,
      "intro_text": "以 50 名關鍵人員為基數、年人均成本 NT$180 萬、合計 NT$9,000 萬。AI 釋放的工時（語音報工、報表查找、排程作業）轉化為可重新部署的產能價值。注意：更大獎金在『避免』——避免 POC 燒錢、避免機密外洩罰則、避免外銷稽核失分丟單。",
      "translation_box": "<strong>核心算式：</strong>回收產能價值 = 總人力成本 9,000萬 × 工時節省比例<br><strong>投資回報：</strong>"
    },
    {
      "page": "08",
      "layout": "interactive-roadmap",
      "progress_label": "PLAN",
      "title": "90 天 Quick-Win 路線圖（兼補助證據工廠）",
      "subtitle": "先在一條產線打一場必贏的仗",
      "speaker_notes": "【講述重點】這張一石二鳥——既是落地路線，也是補助證據工廠。【關鍵】分階段降風險，每步可驗收、可退場，不一次梭哈。【互動提示】問 CEO：『90 天內您最想先看到哪條產線出成績？』讓他指定試點線。【顧問口訣】試點跑完，補助彈藥也滿了。",
      "tabs": [
        {
          "name": "Month 1：盤點＋治理",
          "content": "<strong>方案主題：</strong>快診＋方案 C 盤點<br><strong>關鍵里程碑：</strong><br>• 4+1 畫布場景盤點排序<br>• 員工 AI 使用守則 M02<br>• DLP 與 ERP 串接藍圖<br>• SBIR/智慧機械計畫書骨架"
        },
        {
          "name": "Month 2-3：旗艦試點",
          "content": "<strong>方案主題：</strong>Voice AI 試點<br><strong>關鍵里程碑：</strong><br>• Voice AI 語音報工報修上線<br>• 複誦確認回路驗收<br>• 工法字典建檔<br>• Quick-Win KPI 量測"
        },
        {
          "name": "Month 4-6：擴推＋補助",
          "content": "<strong>方案主題：</strong>全廠擴散<br><strong>關鍵里程碑：</strong><br>• ERP/CRM 唯讀串接上線<br>• AI Champion 種子擴散<br>• 效益數據備齊<br>• 補助送件＋研抵文件"
        }
      ]
    },
    {
      "page": "09",
      "layout": "next-steps",
      "progress_label": "NEXT",
      "title": "下一步：三個行動，啟動南部智慧製造躍升",
      "subtitle": "從 $6,800 快診開始，把黑手實力升級成 AI 戰力",
      "speaker_notes": "【收尾白】董事長，今天從『不再燒錢死在 POC』談到『用政府的錢做轉型』。三個行動環環相扣：快診看清楚、Voice AI 試點搶有感、補助研抵把錢省回來。【互動提示】直接確認：『我們是否就從 $6,800 快診與一條旗艦產線啟動？』給明確承諾錨點。【結尾金句】逐字念出 closing_quote，停三秒。【顧問口訣】先看清、再開打、後省錢。期待帶領鼎盛在南部樹立精密製造 AI 落地標竿。",
      "card1_title": "$6,800 專家前置快診報告",
      "card1_desc": "4+1 戰略畫布盤點場景，過濾偽需求，排定旗艦試點線",
      "card2_title": "南部智慧製造 AI 落地套餐：Voice AI 旗艦試點",
      "card2_desc": "語音報工報修 90 天 Quick-Win，解放滿手油的師傅雙手",
      "card3_title": "補助＋雙軌研抵：政府與稅額分擔自籌款",
      "card3_desc": "SBIR/智慧機械補助＋產創條例第10條(15%)與第10-1條AI(5%)研抵",
      "closing_quote": "別人照著錯誤的證券範本給您一份不相干的簡報，我們先確認您是誰、外銷怕什麼、師傅手上有沒有油——這不是技術工具的堆砌，這是為精密製造量身打造的 AI 時代生存指南。",
      "consultants": "孟淑慧 資深首席顧問 ＆ 陳文家 策略長"
    }
  ]
}