{
  "client_name": "高強度熱處理廠] 邊緣離線調度與實體繼電器硬熔斷解決方案建議書",
  "client_badge": "OKAYAMA_HEAT GROUP",
  "logo_text": "PHOENIX AI 顧問 x [高強度熱處理廠] 邊緣離線調度與實體繼電器硬熔斷解決方案建議書]",
  "output_dir": "slides/okayama_heat",
  "theme": "obsidian-midnight",
  "audience": "internal",
  "min_slides_required": 11,
  "slides": [
    {
      "page": "00",
      "layout": "cover",
      "progress_label": "COCKPIT",
      "title": "爐溫穩定與輝哥點頭 ➜ 90 天 Quick-Win 駕駛艙",
      "subtitle": "一頁看懂：樹莓派地端隔離、實體硬熔斷迴路、0.5% 節能分紅",
      "version": "v2026.06.01",
      "date": "2026-05-31",
      "speaker_notes": "<ul>\n    <li>開場白：「張總，這頁是給您和財務長看的。如果我們只有 5 分鐘，看完這頁，我們就可以決定是否簽下這個專案。」</li>\n    <li>互動提示：將這張列印為高規 A3 彩色紙，放在總經理與財務長桌中央。</li>\n    <li>顧問口訣：答案先行，讓高層第一秒看見安全防線與利潤回報的雙重閉環。</li>\n  </ul>"
    },
    {
      "page": "01",
      "layout": "cover",
      "progress_label": "COVER",
      "title": "熱處理爐溫 AI 離線調度與機電硬熔斷防護方案",
      "subtitle": "專屬 [宏達熱處理工業] [總經理 閣下] ｜ 6,800 元前置快診方案藍圖",
      "version": "v2026.06.01",
      "date": "2026-05-31",
      "speaker_notes": "<ul>\n    <li>開場白：「張總、各位主管，下午好。我們不談空泛的雲端算力，只談一件事——怎麼在最老舊的熱處理車間，築起一道 100% 物理安全的爐溫調度防線，同時讓 18 年資歷的輝哥全力支持轉型。」</li>\n    <li>互動提示：指向封面下方的機密等級 C3 標籤，強調這是為宏達高度客製的去識別化中間產物。</li>\n    <li>顧問口訣：定錨變革核心——「物理安全是底線，利益對齊是動能」。</li>\n  </ul>"
    },
    {
      "page": "02",
      "layout": "dual-track",
      "progress_label": "M01",
      "title": "雙軌落地戰略：總部安控 × 一線賦能",
      "badge_left": "總部安控",
      "title_left": "財務防漏與系統零污染",
      "content_left": "• DLP 遮罩，製程機密不出防火牆<br>• ERP/CRM 唯讀 API 連接，不寫不改核心<br>• 樹莓派地端運行，完全隔離外部風險<br>• 單月 API 財務告警，封堵算力失控",
      "badge_right": "一線賦能",
      "title_right": "物理安全與人機協作",
      "content_right": "• 樹莓派離線分析，斷網不停線<br>• 10ms 繼電器硬熔斷，異常自動斷電<br>• 輝哥紅色物理一鍵否決按鈕<br>• 變革激勵分紅，阻力轉為合規拉力",
      "speaker_notes": "<ul>\n    <li>講述重點：左軌給 CIO 與財務長（不動核心、控 TCO），右軌給廠長與輝哥（物理安全、有錢拿）。</li>\n    <li>互動提示：問 CIO 廖經理：「您是否最擔心 AI 系統直接寫回核心系統造成數據污染？」正好帶出唯讀與中介層的規劃。</li>\n    <li>顧問口訣：左手控風險，右手防起火，兩手都要硬。</li>\n  </ul>"
    },
    {
      "page": "03",
      "layout": "dual-track",
      "progress_label": "M02",
      "title": "熱處理脆斷索賠與斷訊死機的財務死穴",
      "badge_left": "顯性損失 ｜ 脆化斷裂",
      "title_left": "客訴賠款與丟單危機",
      "content_left": "爐溫與碳勢微小偏差 ➜ 高強度螺絲氫脆化斷裂 ➜ 出口車規扣件面臨百萬級重工索賠；更致命的是流失外銷歐洲 Tier 1 供應商資格，威脅年營收近 5,000 萬的外銷大單。",
      "badge_right": "技術瓶頸 ｜ 雲端死機",
      "title_right": "老舊機電與 8% 網路丟包",
      "content_right": "傳統 SI 強推雲端 AI，在 8% 高丟包率的老舊廠房會頻繁斷訊，導致算法因連續重試死機，PLC 閥門卡死在最後一個異常狀態，引發溫度震盪起火風險。",
      "speaker_notes": "<ul>\n    <li>講述重點：這頁直擊張總第一痛（脆化斷裂客訴、外銷單危急、雲端算法在老舊廠房的先天排斥反應）。</li>\n    <li>互動提示：問財務長：「去年因為熱處理品質波動產生的賠償與廢料重工，在帳上累計有多少？」</li>\n    <li>顧問口訣：不解決物理穩定，再高級的雲端算法都是火災隱患。</li>\n  </ul>"
    },
    {
      "page": "04",
      "layout": "dual-track",
      "progress_label": "M03",
      "title": "機密地端隔離與 ERP 不動核心唯讀串接",
      "badge_left": "地端隔離 ── 樹莓派",
      "title_left": "數據不出車間防線",
      "content_left": "本地部署工業級防磁樹莓派，以 Modbus RTU 唯讀拉取傳感器數據，地端離線推論調度。數據與模型訓練完全隔離於地端，100% 通過外銷 ISO 42001 安全審計。",
      "badge_right": "不動核心 ── 唯讀串接",
      "title_right": "鼎新 ERP 不改不寫",
      "content_right": "樹莓派與 PLC 僅建立非侵入式唯讀對接，不直接修改 PLC 核心保護參值；AI 調度閥門建議需經中介層緩衝，任何寫回需輝哥覆核，保證 ERP 與 PLC 核心零污染。",
      "speaker_notes": "<ul>\n    <li>講述重點：給 CIO 的資安定心丸。我們不動您花十年建的 ERP，只在外面加唯讀、可稽核的邊緣運算。</li>\n    <li>互動提示：問 CIO：「如果 AI 完全唯讀，且在樹莓派本地隔離，您的資安審計是否能綠燈放行？」</li>\n    <li>顧問口訣：系統出事，ERP 與 PLC 永遠是乾淨的。</li>\n  </ul>"
    },
    {
      "page": "05",
      "layout": "dual-track",
      "progress_label": "M04",
      "title": "10ms 繼電器物理熔斷與輝哥一鍵否決按鈕",
      "badge_left": "實體機電 ── 繼電器",
      "title_left": "10ms 線圈失電物理彈開",
      "content_left": "樹莓派本地計算 AI 信心度指數。一旦網路瞬斷或信心度低於 95%，繼電器控制盒在 10 毫秒內線圈失電物理彈開，100% 切斷 AI 寫入權限，無縫退回 PLC 傳統安全保護。",
      "badge_right": "輝哥掌控 ── 物理按鈕",
      "title_right": "直徑 10 公分紅色物理 veto 鍵",
      "content_right": "爐旁安裝大紅色物理 veto 按鈕，直接以實體硬線連接繼電器電源。只要輝哥覺得火色不對，拍下按鈕瞬間物理斷電，AI 權限徹底喪失，主控權 100% 回到輝哥手中。",
      "speaker_notes": "<ul>\n    <li>講述重點：全場輝哥與廠長最關心的一張。不是軟體畫面上的停止，是物理斷電！</li>\n    <li>互動提示：手勢模擬按下大紅色按鈕的動作，強調這給予一線班長絕對的掌控尊嚴。</li>\n    <li>顧問口訣：給人絕對的安全掌控，人才能給 AI 數據的源頭。</li>\n  </ul>"
    },
    {
      "page": "06",
      "layout": "dual-track",
      "progress_label": "M05",
      "title": "變革管理：把阻力化為合規動能的三道防線",
      "badge_left": "輝哥的恐懼",
      "title_left": "責任懸崖與失業焦慮",
      "content_left": "輝哥擔心：AI 調溫出錯起火誰坐牢？AI 學會看火色心法後自己被裁員？這是待了 18 年老臣最真實的生存恐懼。若直接強推，他會故意關閉 API 杯葛專案。",
      "badge_right": "鳳凰顧問對策",
      "title_right": "學徒定位與不裁員承諾書",
      "content_right": "管理上正名為「輝哥專家爐溫調度庫」，將 AI 定位為輝哥的「數位學徒」，輝哥是最終審定委員。總經理親自簽發紙本「不裁員安心承諾書」，貼在爐旁，徹底打消失業焦慮。",
      "speaker_notes": "<ul>\n    <li>講述重點：回應張總如何帶動輝哥。選拔 Champion 種子，讓輝哥當帶頭人。</li>\n    <li>互動提示：展示承諾書草稿，問總經理：「第一天我們就把這張貼在輝哥爐溫箱上，您願意簽名用印嗎？」</li>\n    <li>顧問口訣：消除恐懼，是所有智慧製造的第一個工序。</li>\n  </ul>"
    },
    {
      "page": "07",
      "layout": "dual-track",
      "progress_label": "M06",
      "title": "財務對齊：18% 節能達標之季度分紅協議",
      "badge_left": "18% 節電能耗",
      "title_left": "每年多賺 NT$ 80 萬",
      "content_left": "連續爐溫與碳勢離線精準預測，優化燃氣與電熱配比，預計降低網帶爐能耗 18%，每年為工廠直接省下近 NT$ 80 萬元「電費冤枉稅」。",
      "badge_right": "特許分紅協議",
      "title_right": "省下電費的 0.5% 季度營運紅利",
      "content_right": "策略長協助簽署「綠色節電技術授權協議」，只要良率與省電指標達標，公司將省下電費的 0.5% 作為「專家技術授權紅利」按季發放給輝哥班組，從而將 AI 與其財務利益強綁定。",
      "speaker_notes": "<ul>\n    <li>講述重點：這張將阻力徹底翻轉為拉力。輝哥開始每天主動關注 AI 能不能幫他省電，因為省電等於他自己每季多拿紅利。</li>\n    <li>互動提示：問財務長：「如果能省下 80 萬，分出 4,000 元（0.5%）給輝哥，這筆財務投資是否划算？」財務長一定點頭。</li>\n    <li>顧問口訣：用利益對齊人性，用分紅取代監視。</li>\n  </ul>"
    },
    {
      "page": "08",
      "layout": "interactive-roi",
      "progress_label": "ROI",
      "slider_min": 10,
      "slider_max": 60,
      "slider_default": 40,
      "cost_base": 1800000,
      "num_workers": 50,
      "title": "ROI 互動模擬：釋放的產能，回收多少利潤？",
      "intro_text": "拖動滑桿即時計算機會成本與利潤回收。以 50 名關鍵人員為基數、年人均成本 NT$ 180 萬、合計 NT$ 9,000 萬。AI 釋放的工時（爐溫微調、碳勢查找、排程作業）轉化為可重新部署的產能價值。注意：更大獎金在『避免』——避免脆斷索賠 NT$ 180 萬、避免機密外洩罰則、保住外銷單。",
      "translation_box": "<strong>核心算式：</strong>回收產能價值 = 總人力成本 9,000萬 × 工時節省比例<br><strong>投資回報：</strong>",
      "speaker_notes": "<ul>\n    <li>講述重點：全場高潮，務必現場拉滑桿。先停保守 10%(回收900萬)建立可信，再拉到預設 40%(3,600萬)製造張力。</li>\n    <li>互動提示：問財務長：「我們手動微調、脆斷返修、排程對賬的隱性工時，加起來有沒有四成？」</li>\n    <li>顧問口訣：省下的看得見，避免的更值錢。</li>\n  </ul>"
    },
    {
      "page": "09",
      "layout": "interactive-roadmap",
      "progress_label": "PLAN",
      "title": "90 天 Quick-Win 路線圖 ｜ 先在一口熱處理爐贏一場必贏的仗",
      "speaker_notes": "<ul>\n    <li>講述重點：分階段降風險，每步可驗收、可退場，不一次梭哈。這是最理性的落地路徑。</li>\n    <li>互動提示：問張總：「Month 2 我們只先做 A 網帶爐，這口爐是不是您目前外銷車用螺絲的主力爐？」</li>\n    <li>顧問口訣：試點跑完，補助彈藥與節稅文件也滿了。</li>\n  </ul>",
      "tabs": [
        {
          "name": "Month 1：信任與盤點",
          "content": "<strong>方案主題：</strong>快診＋方案 C 盤點<br>• 總經理親簽不裁員安心承諾書貼上網帶爐旁。<br>• 樹莓派離線分析 API 地端部署與 PLC 唯讀對接。<br>• 爐旁紅色「一鍵否決按鈕」實體硬線裝設完成。<br>• 輝哥升任「AI 大師傅專家庫」首席標記教練。<br>本月核心目標：打消輝哥的起火與責任恐慌，建立對 AI 的安全信任。"
        },
        {
          "name": "Month 2-3：試點與學徒",
          "content": "<strong>方案主題：</strong>單口爐優化試點<br>• 選擇包裝/外銷量最大之「A網帶爐」進行離線調溫預測上線。<br>• 輝哥與顧問每週召開「學徒調校會」，輝哥糾錯一次獎勵 500 元。<br>• 10ms 繼電器物理熔斷上線實測。<br>• A爐脆斷不良率實測控制在 0%，能耗降低數據備齊。<br>本月核心目標：在一口電爐上拿到真實的 Quick-Win 數據與能耗降低實證。"
        }
      ]
    },
    {
      "page": "10",
      "layout": "next-steps",
      "progress_label": "NEXT",
      "title": "下一步行動：三個行動，護航高強度熱處理外銷訂單",
      "card1_title": "Action 1 ｜ 6,800 快診回函",
      "card1_desc": "您已啟動的前置快診服務於今日完成。本解決方案藍圖、ROI 試算與不裁員承諾書草稿將於 72 小時內以正式 PDF 回函送達。您可獨立評估或諮詢第二意見。",
      "card2_title": "Action 2 ｜ 輝哥車間 1 對 1 閉門對談",
      "card2_desc": "若您決定進入下一階段，孟顧問將親自駐點岡山車間，與輝哥在熱處理爐旁進行 90 分鐘 1 對 1 閉門訪談，親手幫您解開他的心結，並調整實體按鈕設計。費用 NT$ 18,000。",
      "card3_title": "Action 3 ｜ 全額折抵 90天陪跑專案",
      "card3_desc": "若輝哥訪談後您決定正式委託我們執行「90天熱處理離線優化與變革管理」專案，前置快診 NT$ 6,800 與輝哥對談 NT$ 18,000 將 **100% 全額折抵**自籌款，前期投入零風險。",
      "closing_quote": "爐溫控制不是大模型的算力問題，是班長擔心起火責任的問題。給他物理 veto 按鈕與節能紅利，AI 學徒就能在最老舊的車間裡，為您護航 5,000 萬的外銷單。",
      "consultants": "孟淑慧 首席顧問 ＆ 陳文家 策略長",
      "speaker_notes": "<ul>\n    <li>收尾白：張總，今天不談空洞的技術，只談『物理安全、責任分擔、利益對齊』。三個行動，前期投入零風險，讓我們從為輝哥解開心結開始。</li>\n    <li>互動提示：直接遞交「輝哥車間 1 對 1」意向確認單。</li>\n    <li>顧問口訣：唸出 closing_quote，眼神堅定，停頓三秒。期待帶領宏達在岡山樹立高強度熱處理 AI 熔斷防護的標竿。</li>\n  </ul>"
    }
  ]
}