{
  "client_name": "全球連鎖茶飲加盟集團",
  "client_badge": "MING CHA DAO GROUP",
  "logo_text": "PHOENIX AI 顧問 x 連鎖茶飲加盟集團",
  "output_dir": "slides/mingchadao",
  "theme": "obsidian-midnight",
  "audience": "internal",
  "min_slides_required": 10,
  "slides": [
    {
      "page": "01",
      "layout": "cover",
      "progress_label": "COVER",
      "title": "茶飲加盟 AI 營運落地與人才培育解決方案",
      "subtitle": "專屬 [全球連鎖茶飲加盟集團] [創辦人 閣下] ｜ 2026 策略研討手冊",
      "version": "v2026.06.01",
      "date": "2026-05-28",
      "speaker_notes": "<ul>\n    <li>開場白：「[創辦人 閣下]，在我們開始前，我想先問一個數字——您去年光是『重複訓練同一個崗位』，花了多少看不見的錢？」用問題破冰，不要急著講方案。</li>\n    <li>互動提示：停頓三秒讓對方思考，再翻頁。封面停留時間不超過 30 秒。</li>\n    <li>顧問口訣：封面只賣『這份東西是為你一家量身做的』，不賣功能。強調右下角的客戶專屬標籤與日期版本，建立『高規格客製』的第一印象。</li>\n  </ul>"
    },
    {
      "page": "02",
      "layout": "dual-track",
      "progress_label": "M01",
      "title": "總部決策軌 × 門店實務軌 ｜ 茶飲體系 AI 雙軌培訓系統",
      "badge_left": "總部橘軌 ｜ 創辦人・區顧・財務",
      "title_left": "AI 戰略畫布與加盟分攤治理",
      "content_left": "為總部與區顧設計的 12 小時實戰工作坊。重點不在學工具操作,而在三件事:盤點全體系最值得變現的 AI 場景、設計一套加盟主願意買單的 SaaS 分攤模型、建立 AI 巡店的「賦能型」績效儀表板。產出一份可直接帶進董事會的 90 天落地路線圖,讓決策層用損益語言而非技術語言推動變革。",
      "badge_right": "門店藍軌 ｜ 店長・工讀生",
      "title_right": "隱形 AI 門店實務微學習",
      "content_right": "為一線設計的 3 小時碎片化微學習。核心原則是「隱形」——絕不要求工讀生學寫提示詞,AI 直接內嵌在現有點單系統與 LINE 裡,一鍵即用。涵蓋語音叫料、新品配方語音導引、客訴即時話術三大場景,讓新人第一天就能穩定產出,把兩週訓練曲線壓縮到兩天。",
      "speaker_notes": "<ul>\n    <li>開場白：「我們不會叫您的工讀生去上 AI 課——他們下週可能就離職了。我們讓 AI 自己藏進他們每天都在用的點單機裡。」</li>\n    <li>互動提示：問創辦人「您現在訓練一個新人到能獨立顧店，要幾天？」記下數字，後面 ROI 頁會用到。</li>\n    <li>顧問口訣：左右兩軌的時數對比（12h vs 3h）是亮點，強調『決策層學深、一線學淺』的分流哲學，這正是降低變革阻力的關鍵。</li>\n  </ul>"
    },
    {
      "page": "03",
      "layout": "dual-track",
      "progress_label": "M02",
      "title": "客訴防禦與個資合規 ｜ 茶飲品牌的數位護城河",
      "badge_left": "客訴防線 ｜ 人機無縫轉接 (HITL)",
      "title_left": "1 秒偵測・1 秒轉接・0 秒摘要",
      "content_left": "當顧客在 LINE 或外送平台出現「過敏」「食安」「爆料」「消保官」等高危詞,系統即時偵測情緒分數,自動凍結 AI 回應權限,1 秒內轉接值班店長並發紅色警示。轉接同時,背景 AI 在 0.5 秒內生成對話摘要(歷史消費、爭議焦點、情緒演變),讓店長 0 秒掌握全局。既享自動化效率,又在公關危機關頭保留人的溫度。",
      "badge_right": "個資防線 ｜ 去識別化遮罩 (DLP)",
      "title_right": "客戶隱私絕不流入外部模型",
      "content_right": "在任何顧客對話流入外部大模型之前,中台遮罩引擎強制去識別化:姓名、電話、信用卡、地址全部替換為佔位標籤。外部 LLM 只看得到結構化的去識別資訊,真實個資永不進入訓練庫。完美防禦「影子 AI」外洩風險,符合個資法第 8 條與 ISO 42001 高隱私標準,讓品牌在面對加盟商與消費者時都站得住腳。",
      "speaker_notes": "<ul>\n    <li>開場白：「2024 年某飲料品牌一則食安客訴上了社會新聞，市值蒸發比賠償金高十倍。讓我告訴您他們的系統缺了哪一道防線。」</li>\n    <li>互動提示：問「您現在的客訴從工讀生反應到店長處理，平均要多久？」對比『1 秒』製造衝擊。</li>\n    <li>顧問口訣：客戶常反問『AI 誤判把好客人擋掉怎麼辦』——回應方向是 HITL 保留人工最終決定權，AI 只負責偵測與轉接，不負責拒絕客人。</li>\n  </ul>"
    },
    {
      "page": "04",
      "layout": "dual-track",
      "progress_label": "M03",
      "title": "AI 行銷視覺生成 × 著作權安全防線",
      "badge_left": "著作權三原則",
      "title_left": "純 AI 作品不受保護的風險",
      "content_left": "行銷部須知三件事:第一,純 AI 生成、無人類實質創意投入的作品不受著作權法保護,競品可任意複製你的 AI 代言人。第二,透過 Photoshop 二次創作、加入品牌獨特識別,使作品具「人類原創性」才能受保護。第三,AI 影片配樂必須使用具商業授權的平台,杜絕侵權索賠。茶飲行銷節奏極快,這三道防線讓行銷團隊跑得快又不踩雷。",
      "badge_right": "肖像權防線",
      "title_right": "員工 AI 代言人授權同意書",
      "content_right": "若行銷部融合工讀生臉部特徵生成虛擬代言人,務必簽署肖像權商用授權書:明訂特徵融合範圍、永久商業使用權、離職後的名譽防禦條款。曾有品牌因離職員工控告肖像侵權,被迫下架全部廣告並賠償。本模組提供經律師審定的範本,為行銷部掃除使用虛擬代言人的一切法律隱患。",
      "speaker_notes": "<ul>\n    <li>開場白：「您花大錢做的 AI 代言人，法律上可能根本不是您的——除非做對一件事。」</li>\n    <li>互動提示：詢問客戶目前是否已在用 AI 生成行銷素材，評估其暴露的法律風險等級。</li>\n    <li>顧問口訣：這頁的價值在『防坑』，不要賣技術，要賣安心。強調我們提供律師審定範本，這是 SI 廠商給不了的。</li>\n  </ul>"
    },
    {
      "page": "05",
      "layout": "dual-track",
      "progress_label": "M04",
      "title": "SIIR 政府研發補助 ｜ 讓政策紅利為轉型買單",
      "badge_left": "補助對接",
      "title_left": "服務業創新研發三大提案方向",
      "content_left": "我們協助茶飲體系對接經濟部 SIIR 服務業創新研發補助,三個高過件方向:一是多語 Voice AI 智慧叫料系統(解決外籍/工讀生溝通與高流動痛點);二是非侵入式 AI 客訴防禦(解決人力短缺下的服務品質);三是大數據銷量預測與中央廚房備料調度(解決原料報廢與 ESG 減碳)。每個提案都對齊評審委員看重的創新性與社會責任。",
      "badge_right": "核銷保命",
      "title_right": "五大核銷工作手冊",
      "content_right": "補助最大的坑不在申請而在核銷。我們提供五大保命手冊:月度執行追蹤表、發票憑證歸檔規範、人事費核銷規範、設備驗收列管、期中期末報告範本。並對接評審潛規則(如強調與在地大學的產學合作加分),實測能提高過件率。坦白說沒有顧問能保證 100% 過件,但專業包裝能讓你的計畫書在初審就與對手拉開差距。",
      "speaker_notes": "<ul>\n    <li>開場白：「導入 AI 最大的痛是現金流。但政府這兩年針對服務業 AI 的補助是真的多——重點是會不會寫、會不會核銷。」</li>\n    <li>互動提示：問客戶過去是否申請過政府補助、結果如何，據此調整話術深度。</li>\n    <li>顧問口訣：誠信是武器。主動講『沒人能保證 100% 過件』反而建立信任。賣的是專業包裝與核銷陪跑，不是空頭保證。</li>\n  </ul>"
    },
    {
      "page": "06",
      "layout": "dual-track",
      "progress_label": "M05",
      "title": "AI-Native 績效考核 ｜ 讓擁抱 AI 變成對個人有利的選擇",
      "badge_left": "店長級 ｜ 平衡計分卡",
      "title_left": "從行政機器人到超級營運官",
      "content_left": "店長考核三維重塑:行政工時釋放率(權重 30%,用語音 AI 與查詢助理把對帳、盤點、SOP 查詢的雜務時間砍掉);服務品質控制(權重 40%,把釋放的工時轉化為現場巡檯、帶教、VIP 體驗);成本控制精準度(權重 30%,用銷量預測模型把原料報廢率壓低)。讓店長從被雜務淹沒,轉型為專注服務與業績的營運官。",
      "badge_right": "工讀生 ｜ 工具熟練與增值",
      "title_right": "用獎金與晉升驅動 AI 採用",
      "content_right": "一線考核兩維:AI 工具熟練與申報率(權重高,降低對總部 IT 的打擾);新品推薦與會員招募率(把語音 AI 省下的時間轉為主動推銷與拉客)。並設「AI 卓越服務之星」月度激勵,對使用 AI 效率最高或提出流程優化的工讀生發放專屬獎金並由創辦人親自表揚。唯有利益與制度對齊,一線才會主動擁抱 AI,徹底掃除『被取代』的抗拒恐懼。",
      "speaker_notes": "<ul>\n    <li>開場白：「員工抗拒 AI，從來不是因為 AI 難用，是因為他們怕被取代、怕被扣薪。我們用制度把這個恐懼反轉成誘因。」</li>\n    <li>互動提示：問創辦人『您現在怎麼考核店長？』多半會發現考核項目裡全是行政指標，正好對比。</li>\n    <li>顧問口訣：強調『賦能不是監控』。AI 巡店的數據是用來幫店長拿獎金，不是用來抓他的錯——這個敘事決定一線買不買單。</li>\n  </ul>"
    },
    {
      "page": "07",
      "layout": "interactive-roi",
      "progress_label": "ROI",
      "slider_min": 5,
      "slider_max": 40,
      "slider_default": 15,
      "cost_base": 480000,
      "num_workers": 450,
      "title": "即時 ROI 模擬 ｜ 450 家門店報廢率下降的利潤威力",
      "intro_text": "拖動滑桿,模擬「原料報廢率下降幅度」對全體系利潤的影響。以 450 家門店為基準,每家月均原料相關成本約 NT$ 48 萬計算,當大數據銷量預測把報廢率從現況下降 15%,全體系一年釋放的利潤金額將直接顯示在螢幕上。這不是估計,是用你自己的門店數與成本基準當場算出來的數字——讓財務語言取代技術話術。",
      "translation_box": "【如何用這個模型說服加盟主分攤 SaaS 費】當加盟主問「這套系統月費要我出,對我有什麼好處?」——不要講技術,直接拖滑桿給他看:「您單店一個月光是報廢就燒掉這麼多錢。這套系統的月費,只佔它幫您省下金額的零頭。您是要每月省下這筆錢,還是繼續把原料倒進垃圾桶?」把 SaaS 月費翻譯成「省下的錢遠大於付出的費」,政治僵局當場鬆動。",
      "speaker_notes": "<ul>\n    <li>開場白：「我不跟您講準確率幾趴，那是工程師的語言。我直接用您 450 家店的數字，當場算給您看一年多賺多少。」</li>\n    <li>互動提示：把滑桿交給創辦人本人拖。動手的參與感比你講十分鐘都有效——拖到 15% 時停住，讓他自己讀出那個利潤數字。</li>\n    <li>顧問口訣：這頁是成交關鍵頁。數字一出來先沉默三秒，讓金額自己說話。然後輕聲說：『這還只是報廢這一項。』</li>\n  </ul>"
    },
    {
      "page": "08",
      "layout": "dual-track",
      "progress_label": "M06",
      "title": "AI SaaS 採購財務與合約防坑檢核",
      "badge_left": "財務防坑 ｜ 隱性 Token 計費",
      "title_left": "破解上下文累積與 Prompt 沉沒成本",
      "content_left": "兩個隱性計費大坑:一是對話上下文累積——每次對話都把歷史全打包送模型,聊到第 20 句時 Token 成本是第 1 句的 20 倍。合約須強制廠商內建滑動窗口或摘要截斷壓縮機制。二是 System Prompt 上萬字沉沒成本——廠商在後台寫超長系統設定,每次對話都重複消耗。合約須強制使用 Prompt Caching 技術,讓重複內容讀取費用降低九成以上。",
      "badge_right": "退場防線 ｜ SLA 與 Exit 機制",
      "title_right": "數據可攜與廠商倒閉保護",
      "content_right": "AI 新創倒閉率極高,兩道保護不可少:一是 SLA 效能保證,合約須載明延遲上限與系統可用率,AI 因瑕疵造成超額賠償時廠商須分擔損失。二是退場 Exit 機制,明訂你方擁有 100% 數據所有權,廠商須定期備份對話歷史與 Prompt,終止服務須提前 90 天通知並無條件協助數據轉移,確保品牌數據資產永不蒸發。",
      "speaker_notes": "<ul>\n    <li>開場白：「99% 的 AI SaaS 都是租的。簽約前看不懂這兩個隱性計費坑，您會在第三個月收到一張嚇人的帳單。」</li>\n    <li>互動提示：問客戶目前有沒有在用任何 AI 訂閱服務，是否看過合約裡的計費與退場條款。</li>\n    <li>顧問口訣：這頁建立『我們站在你這邊防廠商』的信任，凸顯鳳凰 AI 不是來賣軟體賺價差，而是來幫你守住荷包與數據。</li>\n  </ul>"
    },
    {
      "page": "09",
      "layout": "interactive-roadmap",
      "progress_label": "PLAN",
      "title": "90 天 Quick-Win 落地路線圖 ｜ 雙軌並進實施日程",
      "speaker_notes": "<ul>\n    <li>開場白：「我們不賣『一次到位的夢』。我們賣『90 天看得到第一個成果』的務實路線。」</li>\n    <li>互動提示：讓客戶點擊三個分頁，引導他想像每個階段自己的角色與該做的決定。</li>\n    <li>顧問口訣：誠信盲區要主動講——『Month 1 我們只做 1-2 個場景，不是我們能力不足，是貪多必敗。先贏一場小的，再贏大的。』</li>\n  </ul>",
      "tabs": [
        {
          "name": "Month 1（啟動評估）",
          "content": "第一個月聚焦盤點與選點。完成全體系 AI 場景盤點工作坊,鎖定 1-2 個 Quick-Win 場景(通常是語音叫料或銷量預測);選定 3-5 家代表性門店作為試點(涵蓋商場店、街邊店、辦公商圈店三種型態);完成加盟主 SaaS 分攤模型的初版設計與內部溝通;同步啟動 SIIR 補助計畫書撰寫。本月關鍵是『不貪多』——選對場景比做多功能重要。"
        },
        {
          "name": "Month 3（試點驗證）",
          "content": "第三個月驗證成效並蒐集鐵證。試點門店的語音 AI 與視覺辨識上線運行,蒐集真實數據:新人訓練曲線縮短了幾天、原料報廢率下降幾趴、客訴處理時間縮短多少。每週召開試點檢討會,允許出錯、快速迭代。同步用試點門店的真實 ROI 數字,回頭優化加盟主分攤談判話術——用事實而非簡報說服下一批加盟主。"
        }
      ]
    },
    {
      "page": "10",
      "layout": "next-steps",
      "progress_label": "NEXT",
      "title": "下一步行動指引 ｜ 成為 AI-Native 領先品牌",
      "card1_title": "Action 1 ｜ 前置診斷",
      "card1_desc": "以 NT$ 6,800 啟動企業 AI 前置診斷,顧問團隊到場盤點貴體系最值得變現的 AI 場景,並評估 SIIR 補助申報路徑與可行性,產出一份初步診斷報告。這是最低風險的第一步,讓您在投入大筆預算前先看清地圖。",
      "card2_title": "Action 2 ｜ 戰術工作坊",
      "card2_desc": "正式啟動【方案 B：企業 AI 一頁式戰術畫布實戰工作坊】,帶領總部幕僚與區顧,在 1 天內用 4+1 戰術畫布盤點 20 大 AI 潛力場景,當場精算每個場景的 Build vs Buy vs Rent 財務可行性,產出可向董事會匯報的高規格決策簡報。",
      "card3_title": "Action 3 ｜ 100% 全額折抵",
      "card3_desc": "工作坊順利完成後,若貴集團決定委託我們進行後續的「90 天 AI 落地變革陪跑輔導」,本前置診斷與工作坊之全部費用將 100% 全額折抵專案款項。讓您的每一分前期投入都不浪費,降低決策門檻。",
      "closing_quote": "這不是寫給學術界的教科書,而是一套寫給手搖飲變革者看的戰術手冊。",
      "consultants": "孟淑慧 ＆ 陳文家",
      "speaker_notes": "<ul>\n    <li>開場白：「我們不要求您今天就決定整個專案。我們只請您踏出風險最低的第一步。」</li>\n    <li>互動提示：明確指向 Action 1 的 NT$ 6,800 前置診斷，這是『低門檻試水溫』的鉤子，降低對方說 yes 的心理負擔。</li>\n    <li>顧問口訣：用『100% 全額折抵』收尾——讓對方覺得『反正前期費用之後都會折抵，等於沒有額外風險』。最後唸出金句，停頓，遞名片。</li>\n  </ul>"
    }
  ]
}