{
  "client_name": "精密金屬包裝廠] AI 視覺防錯與中高齡安心變革解決方案建議書",
  "client_badge": "OKAYAMA_BARCODE GROUP",
  "logo_text": "PHOENIX AI 顧問 x [精密金屬包裝廠] AI 視覺防錯與中高齡安心變革解決方案建議書]",
  "output_dir": "slides/okayama_barcode",
  "theme": "obsidian-midnight",
  "audience": "internal",
  "min_slides_required": 13,
  "slides": [
    {
      "page": "00",
      "layout": "cover",
      "progress_label": "COCKPIT",
      "title": "110 萬退貨損失 ➜ 90 天歸零路線圖",
      "subtitle": "一頁看完:三項投資、四個月回本、鳳姐當隊長",
      "version": "v2026.06.01",
      "date": "2026-05-28",
      "speaker_notes": "<ul>\n    <li>開場白：「[總經理 閣下]，這頁是給您看的。如果您只看一張，看這張就夠。其他 12 張都是為了支撐這張結論。」</li>\n    <li>互動提示：把這頁印出來放他桌上，整個快診結束他至少會帶這張回辦公室。</li>\n    <li>顧問口訣：強調「答案先行」——這就是 Tier 0 駕駛艙的精神，敢用一張紙下結論才叫顧問。</li>\n  </ul>"
    },
    {
      "page": "01",
      "layout": "cover",
      "progress_label": "COVER",
      "title": "AI 視覺防錯與中高齡安心變革解決方案",
      "subtitle": "專屬 [精密金屬包裝廠] [總經理 閣下] ｜ 6,800 元快診回函暨落地藍圖",
      "version": "v2026.06.01",
      "date": "2026-05-28",
      "speaker_notes": "<ul>\n    <li>開場白：「[總經理 閣下]，我們先講一件事——這份東西不是來賣您 AI 軟體，是來幫您解決鳳姐的問題。如果鳳姐不點頭，AI 再厲害都跑不起來。」</li>\n    <li>互動提示：封面停留時間不超過 20 秒，重點是讓他感受到「這份是專為他做的」——指右下角的客戶代號與日期。</li>\n    <li>顧問口訣：定錨變革主敘事——「人的問題優先於技術問題」。整場簡報的張力都從這句話展開。</li>\n  </ul>"
    },
    {
      "page": "02",
      "layout": "dual-track",
      "progress_label": "DIAGNOSTIC",
      "title": "110 萬只是冰山一角 ｜ 退貨損失的真實全貌",
      "badge_left": "顯性損失 ｜ 帳上看得到",
      "title_left": "帳面 110 萬的組成",
      "content_left": "重工包裝工資、國際航空退運費、車廠客訴賠款這三項,是您 ERP 每月對得出來的數字。但這只是「您已經知道的損失」,真正可怕的是 ERP 看不到的那層。",
      "badge_right": "隱性損失 ｜ 三年後才痛",
      "title_right": "看不到但更傷的三筆帳",
      "content_right": "訂單流失(失去一個 Tier 1 車廠單年損失 800 萬+)、資深員工心理稅(鳳姐越擔心、品質越下滑)、供應鏈位階下滑(退貨率每多 1%,毛利率長期磨損 0.5-1%)。AI 真正守護的是您的品質牌。",
      "speaker_notes": "<ul>\n    <li>開場白：「您看到的 110 萬，是冰山露出水面那一角。讓我告訴您水面下還有什麼。」</li>\n    <li>互動提示：問總經理「您去年有沒有失去過任何車廠客戶？」——多半會有，那筆損失沒進 110 萬。</li>\n    <li>顧問口訣：用「冰山」這個視覺比喻會讓他記住整場簡報的開場。技術細節不重要，這個比喻才重要。</li>\n  </ul>"
    },
    {
      "page": "03",
      "layout": "dual-track",
      "progress_label": "DIAGNOSTIC",
      "title": "半年導入失敗的真正原因 ｜ 鳳姐的三層恐懼",
      "badge_left": "表面原因 ｜ SI 廠商的說法",
      "title_left": "「資料缺損、無法運轉」",
      "content_left": "SI 廠商會告訴您是「影像標記資料不足、模型訓練不夠」。這是技術視角的診斷,沒有錯,但只看到一半。真正的問題在資料為什麼會斷糧——是因為鳳姐拒絕配合拍照標記。",
      "badge_right": "深層原因 ｜ 鳳姐的三層恐懼",
      "title_right": "操作 / 扣薪 / 存在",
      "content_right": "第一層是 iPad 點選對 56 歲雙手的物理障礙;第二層是動作變慢就少領錢的扣薪恐懼;第三層也是最深的——跟不上 AI 等於 17 年資歷一夕歸零的存在恐懼。三層必須一起解,缺一層鳳姐就不買單。",
      "speaker_notes": "<ul>\n    <li>開場白：「您的 SI 廠商沒講錯，但他只講了一半。讓我告訴您另一半。」</li>\n    <li>互動提示：問「您覺得鳳姐最怕的是哪一層？」聽他怎麼答。多數老闆會答錯，這個錯誤本身就是教材。</li>\n    <li>顧問口訣：點出「工程師處理一層、SI 處理兩層、顧問處理三層」——這是我們收顧問費的核心價值。</li>\n  </ul>"
    },
    {
      "page": "04",
      "layout": "dual-track",
      "progress_label": "DIAGNOSTIC",
      "title": "從「被取代的人」到「AI 的師傅」 ｜ 戰略翻轉",
      "badge_left": "過去半年的錯位",
      "title_left": "鳳姐 = 阻礙者",
      "content_left": "過去半年把鳳姐定位成「需要被馴服的舊員工」,所有設計都圍繞「怎麼讓她聽話」。結果是她遮擋鏡頭、抵制標記,專案資料斷糧。錯位的根源是把人當成阻礙,不是資產。",
      "badge_right": "本案的戰略翻轉",
      "title_right": "鳳姐 = AI 的師傅",
      "content_right": "17 年看過數百萬顆螺絲,她的肌肉判斷是廠裡最稀缺的資產。我們設計新角色「AI 標記教練」讓她**教 AI 認螺絲**,而不是讓 AI 監督她。一個敘事翻轉,把最大阻力變成最強助力。",
      "speaker_notes": "<ul>\n    <li>開場白：「鳳姐不是您的問題，是您過去 17 年累積的資產。我們只是把她的角色重新定位。」</li>\n    <li>互動提示：講到「教 AI 認螺絲」時看總經理的眼睛——多數老闆會在這一刻決定買單。</li>\n    <li>顧問口訣：這頁是整場簡報的「啊哈時刻（aha moment）」。語速放慢、停頓兩次，讓他自己消化。</li>\n  </ul>"
    },
    {
      "page": "05",
      "layout": "dual-track",
      "progress_label": "SOLUTION",
      "title": "鳳姐介面 (Feng-jie UI) ｜ 零點擊、零打字、零選單",
      "badge_left": "過去的 iPad 介面 ｜ 為什麼鳳姐拒用",
      "title_left": "四步驟點選地獄",
      "content_left": "拍照、上傳、選類別、輸入備註——對 56 歲的雙手是四道障礙。她每錯一次,前端就掉一筆資料。介面本身就是過濾掉老員工的隱形篩網,難怪資料斷糧。",
      "badge_right": "新介面三步驟流程",
      "title_right": "放、看、按",
      "content_right": "包裝完成放上工作檯凹槽(只有放對位置才能繼續)→ AI 自動拍照比對 → 紅綠燈回饋。綠燈過關、黃燈一顆大按鈕複核、紅燈系統自動鎖定。整個流程鳳姐沒有任何點螢幕的動作。",
      "speaker_notes": "<ul>\n    <li>開場白：「我把這個介面取名叫『鳳姐介面』——這不是玩笑話，是這套系統的設計憲法：為她設計，不是為工程師設計。」</li>\n    <li>互動提示：用手勢演示「放、看、按」三個動作。視覺比文字有效。</li>\n    <li>顧問口訣：強調「鳳姐沒有意識到自己在標記，但 AI 每天能收到 10 萬筆高品質標記」——這就是把抗拒者翻轉為資料源的工程藝術。</li>\n  </ul>"
    },
    {
      "page": "06",
      "layout": "dual-track",
      "progress_label": "SOLUTION",
      "title": "AI 防錯達標獎金 ｜ 化解鳳姐扣薪恐懼的鐵律",
      "badge_left": "鐵律 ｜ 只加不減",
      "title_left": "AI 引入不得新增扣分項",
      "content_left": "任何因 AI 而新增的考核,**只能是加分項,不能是扣分項**。低於 85% 通過率,不扣薪,改派包裝課長帶教(這是「協助」不是「處分」)。違反這條鐵律,前面所有努力歸零。",
      "badge_right": "兩個新增獎金",
      "title_right": "月度疊加,鳳姐津貼最高",
      "content_right": "防錯達標獎金(月):≥95% 領 2,500、90-95% 領 1,500、85-90% 領 800。AI 標記教練津貼(月):鳳姐獨享 5,000。鳳姐的津貼刻意設計成比一線獎金高——這是把存在恐懼翻轉為存在尊嚴的關鍵。",
      "speaker_notes": "<ul>\n    <li>開場白：「[總經理 閣下]，這頁的數字是我們算過的，可以調整，但有一條不能調——『只加不減』這條鐵律。一旦破例，鳳姐就會把您當敵人。」</li>\n    <li>互動提示：問他「您現在的績效制度裡，有沒有任何項目是會扣薪的？」——把扣薪項目盤出來，AI 上線前要先把它們處理掉。</li>\n    <li>顧問口訣：強調這不是技術設計，是制度設計。技術做得再好，制度錯一條就全盤皆輸。</li>\n  </ul>"
    },
    {
      "page": "07",
      "layout": "dual-track",
      "progress_label": "SOLUTION",
      "title": "不裁員承諾書 ｜ 第一天最重要的動作",
      "badge_left": "為什麼必須是您本人",
      "title_left": "信任的層級對應原則",
      "content_left": "課長簽的承諾鳳姐不信,廠長簽的鳳姐半信半疑。**只有 [總經理 閣下] 親自簽下,鳳姐才會真信**。這不是儀式,是信任的層級對應原則——存在恐懼必須由能解雇她的人親自解除。",
      "badge_right": "承諾書三要素",
      "title_right": "印出來、用紙、用印",
      "content_right": "一、明文承諾 50 歲以上員工不因 AI 導入被資遣或減薪。二、效期至 AI 專案完成後三年。三、印出來、用印、貼在包裝線最顯眼處。電子檔沒用——鳳姐這個世代相信紙與印章,不相信螢幕。",
      "speaker_notes": "<ul>\n    <li>開場白：「第一天上工不是工程師進廠，是您本人到包裝線把承諾書當著鳳姐的面簽下去。這個動作的價值，等於後面三個月所有工程努力的總和。」</li>\n    <li>互動提示：把承諾書草稿當場拿出來放在他面前。讓他感受到「我們已經幫您寫好了，您只要決定簽不簽」。</li>\n    <li>顧問口訣：這頁如果他猶豫，整個專案就有風險。看他的反應決定後面要不要加碼或保留。</li>\n  </ul>"
    },
    {
      "page": "08",
      "layout": "dual-track",
      "progress_label": "SOLUTION",
      "title": "地端推論 + DLP 遮罩網閘 ｜ 守住車廠供應商資格",
      "badge_left": "為什麼必須地端",
      "title_left": "一次外洩 = IATF 16949 除名",
      "content_left": "出貨標籤含客戶採購單號、品名規格、批號、目的地車廠——這是您客戶的供應鏈情資。雖然您非金融證券業,但 Tier 1 車廠資安要求極高,一次外洩您會被踢出 IATF 16949 合格供應商名單,失去外銷資格。",
      "badge_right": "雙引擎核對 + HITL 雙簽",
      "title_right": "OCR + Layout-Aware",
      "content_right": "引擎 A(OCR)讀標籤文字;引擎 B(版面感知)確認標籤版面是否符合該客戶的歷史格式——這專門對付「規格印對但客戶貼錯」的混料案例。紅燈案例必須鳳姐 + 包裝課長雙簽放行,責任分攤。",
      "speaker_notes": "<ul>\n    <li>開場白：「您現在做的不只是螺絲，您做的是車廠供應鏈的一環。我們要保護的不只是您的廠，是您客戶的客戶。」</li>\n    <li>互動提示：問他「您目前有哪幾家 Tier 1 車廠客戶？」——把名字記下，後面財務頁會用到。</li>\n    <li>顧問口訣：把「雙簽」說成「責任分攤」而不是「不信任您」——這個用詞差異決定包裝課長願不願意配合。</li>\n  </ul>"
    },
    {
      "page": "09",
      "layout": "interactive-roi",
      "progress_label": "ROI",
      "slider_min": 10,
      "slider_max": 60,
      "slider_default": 40,
      "cost_base": 1800000,
      "num_workers": 50,
      "title": "即時 ROI 模擬 ｜ 退貨率下降的利潤回收",
      "intro_text": "拖動滑桿模擬「退貨率下降幅度」對年度利潤的直接影響。以您 50 名員工、年人均成本 NT$ 180 萬為基準,當退貨率從現況 3.2% 下降 40%(滑桿預設值),一年釋放的利潤數字當場顯示。這不是估計,是用您自己的人力結構與成本基準算出來的數字。",
      "translation_box": "【白話翻譯】這個滑桿讓我們把「準確率 95%」這種工程師語言,翻譯成「您今年多賺多少」這種您能在董事會講的話。把滑桿拖到 40%,出現的金額就是這套系統第一年要幫您賺回來的最低目標——我們把回本承諾寫進合約。",
      "speaker_notes": "<ul>\n    <li>開場白：「我不跟您講準確率幾趴，那是工程師的語言。我用您 50 個員工、180 萬人均成本，當場算給您看一年多賺多少。」</li>\n    <li>互動提示：把滑桿交給總經理本人拖。動手的參與感比講十分鐘有效——拖到 40% 停住，讓他自己讀出那個利潤數字。</li>\n    <li>顧問口訣：金額出來先沉默三秒，讓數字自己說話。然後輕聲說：「這還只是退貨這一項，沒算保住車廠客戶的長期價值。」</li>\n  </ul>"
    },
    {
      "page": "10",
      "layout": "interactive-roadmap",
      "progress_label": "PLAN",
      "title": "90 天 Quick-Win 落地路線圖 ｜ 鳳姐當隊長的三階段",
      "speaker_notes": "<ul>\n    <li>開場白：「我們不賣『一次到位的夢』。我們賣『第一天就看得到改變、90 天看得到第一個成果』的務實路線。」</li>\n    <li>互動提示：讓總經理點擊三個分頁，引導他想像每個階段自己的角色——特別是 Month 1 他要簽承諾書這件事。</li>\n    <li>顧問口訣：誠信盲區要主動講——「Month 1 我們只做 A 線，不是能力不足，是先贏一場小的。一條線都跑不順就推三條線是顧問業最常見的死法。」</li>\n  </ul>",
      "tabs": [
        {
          "name": "Month 1（認同建立期）",
          "content": "第一天 [總經理 閣下] 親簽不裁員承諾書貼上包裝線。第一週鳳姐升任 AI 標記教練,新津貼立刻生效。第二週鳳姐介面在包裝 A 線試跑,允許出錯、快速迭代。第一個月結束前完成績效獎金制度公告,讓所有人知道「只加不減」這條鐵律。本月關鍵不是技術,是建立鳳姐與她的姊妹們對專案的信任。"
        },
        {
          "name": "Month 3（試點驗證期）",
          "content": "包裝 A 線全面上線,蒐集真實數據:退貨率下降幾趴、紅綠燈通過率、AI 與鳳姐判斷一致度。每週開試點檢討會,讓鳳姐主持其中一場(這是給她的「教練身份」的具體展現)。同步用 A 線數據優化模型,為橫向推廣做準備。本月底用真實 ROI 數字回頭驗證快診時的承諾。"
        }
      ]
    },
    {
      "page": "11",
      "layout": "dual-track",
      "progress_label": "CHANGE",
      "title": "三大風險與化解對策 ｜ 顧問該講的真話",
      "badge_left": "風險清單",
      "title_left": "三個可能讓專案失敗的點",
      "content_left": "一、鳳姐簽完承諾書後仍有疑慮(信任建立需時間)。二、紅綠燈介面初期誤判率高,鳳姐覺得「AI 不如我」(模型熟成需數據)。三、其他資深員工嫉妒鳳姐獨享教練津貼(內部相對剝奪感)。",
      "badge_right": "化解對策",
      "title_right": "每個風險對應一個機制",
      "content_right": "一、第二週安排鳳姐與孟顧問私下對談,讓她直接提疑慮。二、初期黃燈閾值放寬,讓鳳姐感受「AI 在學我」而非「AI 在挑戰我」。三、第二個月啟動「資深員工帶教制度」,讓更多人能拿教練津貼,把獨享變成共享。",
      "speaker_notes": "<ul>\n    <li>開場白：「[總經理 閣下]，這頁是我們作為顧問的誠信底線——把可能失敗的地方先講給您聽。」</li>\n    <li>互動提示：問他「您覺得我們漏掉了什麼風險？」——這個問句會讓他覺得自己是專案合夥人不是付錢的客戶。</li>\n    <li>顧問口訣：顧問業最大的不誠實就是「報喜不報憂」。我們敢列風險清單，這本身就是顧問品牌的差異化。</li>\n  </ul>"
    },
    {
      "page": "12",
      "layout": "next-steps",
      "progress_label": "NEXT",
      "title": "下一步行動 ｜ 您今天只需要做一個決定",
      "card1_title": "Action 1 ｜ 6,800 快診結束",
      "card1_desc": "您已啟動的快診服務於今日完成。我們會在 72 小時內,將完整的快診報告(含本份建議書、ROI 試算表、不裁員承諾書草稿)送達您手上。這份報告您可獨立評估或諮詢第二意見。",
      "card2_title": "Action 2 ｜ 鳳姐專場 1 對 1",
      "card2_desc": "若您決定進入下一階段,我們提供「鳳姐專場」服務——孟顧問親自到廠,與鳳姐一對一閉門對談 90 分鐘,直接聽她的真實想法並調整方案。費用 NT$ 18,000。這場不過鳳姐這關,整個專案就停在這。",
      "card3_title": "Action 3 ｜ 全額折抵變革專案",
      "card3_desc": "若鳳姐專場後您決定正式委託我們執行「90 天 AI 視覺防錯與變革管理陪跑」專案,本快診費用 NT$ 6,800 與鳳姐專場費用 NT$ 18,000 將 **100% 全額折抵**專案款項。您前期投入零浪費,降低決策門檻。",
      "closing_quote": "110 萬退貨損失不是技術問題,是鳳姐被當成阻礙的問題。把她變成隊長,問題就解了一半。",
      "consultants": "孟淑慧 ＆ 陳文家",
      "speaker_notes": "<ul>\n    <li>開場白：「[總經理 閣下]，我們不要求您今天就決定整個專案。我們只請您決定『要不要見鳳姐一次』。」</li>\n    <li>互動提示：明確指向 Action 2 的「鳳姐專場」，這是這份方案的靈魂——不見鳳姐就不算真正啟動。</li>\n    <li>顧問口訣：用「全額折抵」收尾——讓他覺得前期投入零風險。最後唸出金句，停頓三秒，遞名片。注意：金句裡的「鳳姐」這個稱呼必須親切自然，不要念成全名，這是溫度的關鍵。</li>\n  </ul>"
    }
  ]
}