{
  "client_name": "振鑫表面防鏽] 電鍍配方優化",
  "client_badge": "OKAYAMA_ELECTROPLATE GROUP",
  "logo_text": "PHOENIX AI 顧問 x [振鑫表面防鏽] 電鍍配方優化]",
  "output_dir": "slides/okayama_electroplate",
  "theme": "obsidian-midnight",
  "audience": "internal",
  "min_slides_required": 11,
  "slides": [
    {
      "page": "00",
      "layout": "cover",
      "progress_label": "COCKPIT",
      "title": "1.9 億車規命脈與 90 天配方收斂零開罰路線圖",
      "subtitle": "一頁看懂：濾鏡升級、特許授權、明哥變合夥人",
      "version": "v2026.06.01",
      "date": "2026-05-31",
      "speaker_notes": "<ul>\n    <li>開場白：「許總，這頁是您的決策駕駛艙。我們用這一頁向您承諾：吉翔航太的底盤螺栓訂單我們保證無損出貨，而且這不是靠跟明哥對立，是靠一紙 IP 特許授權合約，把他變成我們的變革隊長。」</li>\n    <li>互動提示：將決策駕駛艙直接遞給許總，重點指出 Month 1（特許授權、不裁員承諾）到 Month 3（良率98.8%、廢水達標、年省120萬）的轉折。</li>\n    <li>顧問口訣：強調「答案先行」——這就是 Tier 0 駕駛艙的商業力量，用最直白的一頁紙下結論。</li>\n  </ul>"
    },
    {
      "page": "01",
      "layout": "cover",
      "progress_label": "COVER",
      "title": "電鍍配方優化、廢水排污達標與化學師變革解決方案",
      "subtitle": "專屬 [振鑫表面防鏽] [總經理 許振鑫 閣下] ｜ 6,800 元前置快診回函",
      "version": "v2026.06.01",
      "date": "2026-05-31",
      "speaker_notes": "<ul>\n    <li>開場白：「許總，我們先定調真話——振鑫的危機不是高雄市環保局的 120 萬罰單，而是明哥在後台登錄假數據的心魔。心魔不解，AI 再準都是一堆沙堡。」</li>\n    <li>互動提示：封面短暫停留，直接進入對明哥心結的剖析，展現顧問對人性深度的洞察。</li>\n    <li>顧問口訣：定錨變革主敘事——「人的問題優先於技術問題」。整場簡報的張力都從這句話展開。</li>\n  </ul>"
    },
    {
      "page": "02",
      "layout": "dual-track",
      "progress_label": "DIAGNOSTIC",
      "title": "120 萬罰單的深層威脅 ｜ 車規供應鏈的一票否決",
      "badge_left": "顯性風險 ── 帳面上看得到",
      "title_left": "環保超標重罰與改善預算",
      "content_left": "電鍍液酸鹼度與重金屬（鎳、鉻）頻繁超標排放，曾被高雄市環保局重罰數十萬，年累計處罰與改善預算高達 120 萬。財務大筆失血。",
      "badge_right": "隱性風險 ── 汽車供應鏈的一票否決",
      "title_right": "IATF 16949 資格吊銷與勒令停工",
      "content_right": "鋅鎳底盤件安全係數高。一旦因環保排污被勒令停工整頓，交期斷線將當場吊銷 IATF 16949 資格，吉翔航太等大客戶會立刻撤單並高額索賠，動搖 1.9 億營收根基。",
      "speaker_notes": "<ul>\n    <li>開場白：「環保罰單只是傷財，但如果環保局勒令停工，車廠大客戶會在 24 小時內啟動備用供應商，吊銷您的 IATF 資格。這才是振鑫的滅頂之災。」</li>\n    <li>互動提示：在「IATF 16949 吊銷」處加重語氣，觀察許總的神情。</li>\n    <li>顧問口訣：把「合規成本」翻譯成「生存主權」，這是吸引製造業老闆決策的最快方式。</li>\n  </ul>"
    },
    {
      "page": "03",
      "layout": "dual-track",
      "progress_label": "DIAGNOSTIC",
      "title": "明哥為什麼故意登錄假 pH 數據？ ── 資深老臣的三層恐懼",
      "badge_left": "表面現象",
      "title_left": "化驗日誌殘缺不全與故意偏差",
      "content_left": "16 年資歷首席化學師明哥掌握「獨門配方藥水心法」。他私下防備，故意登錄有稍微偏差的數據，導致 POC 的配方預測演算法完全失效、無法收斂。",
      "badge_right": "深層恐懼 ── 存在 / 尊嚴 / 利益",
      "title_right": "技術被 AI 掏空後的資遣裁員恐慌",
      "content_right": "存在恐懼：怕配方交給 AI 後自己明天就被公司資遣；尊嚴恐懼：一輩子實驗室心法被機器廉價收割；利益恐懼：獨門祕技被無償索取，老後退休金缺乏保障。",
      "speaker_notes": "<ul>\n    <li>開場白：「明哥不配合是有道理的。沒有利益對齊，AI 的上線對他而言就是掏空他大腦、然後裁員他的前奏。他是在為生存而反抗。」</li>\n    <li>互動提示：問「您現在的制度裡，有沒有任何機制是能保障明哥配方的智慧財產權的？」多數老闆沒有，這就是破綻。</li>\n    <li>顧問口訣：點出「技術工程師只懂代碼，但優秀的顧問懂利益對齊的人性」。</li>\n  </ul>"
    },
    {
      "page": "04",
      "layout": "dual-track",
      "progress_label": "DIAGNOSTIC",
      "title": "本地地端 + DLP 去識別化 ── 確保機密配方絕不上雲",
      "badge_left": "數據隱私防線",
      "title_left": "藥水配方 100% 本地物理隔離",
      "content_left": "航太與車規螺絲的鋅鎳合金添加劑比例是振鑫的核心機密。我們在吉翔內網部署 DLP 去識別化網閘，自動將化學式遮罩屏蔽，大模型僅讀取 pH 值等數值特徵。",
      "badge_right": "技術優勢",
      "title_right": "100% 規避洩密與 NDA 風險",
      "content_right": "地端私有部署 LightGBM 算法收斂，配方細節絕不上傳公有雲，完全合規國際車廠最嚴苛的資訊安全稽核，保障振鑫的技術 IP 萬無一失。",
      "speaker_notes": "<ul>\n    <li>開場白：「我們保證明哥的藥水比例絕對不上雲端。DLP 去識別化網閘在本地就把化學式屏蔽掉，AI 只懂數值，完全杜絕洩密風險。」</li>\n    <li>互動提示：用圖表展示「本地 DLP 閘 ➔ 地端 LightGBM」的封閉網路，消除他們對公有雲的安全防衛。</li>\n    <li>顧問口訣：把「安全性」做到極致，是獲得製造業高管信任的技術敲門磚。</li>\n  </ul>"
    },
    {
      "page": "05",
      "layout": "dual-track",
      "progress_label": "DIAGNOSTIC",
      "title": "專利冠名與 IP 特許授權 ── 利益與尊嚴黃金對齊",
      "badge_left": "尊嚴冠名 ── AI 的導師",
      "title_left": "明哥專利專家配方庫",
      "content_left": "配方系統正名為「明哥專利專家配方庫」，首頁標註其肖像與 16 年榮譽。AI 不再是取代者，而是明哥的「專家學徒」，徹底解開其尊嚴恐懼。",
      "badge_right": "利益對齊 ── 良率排污成果分紅",
      "title_right": "0.5% 季度營運成果紅利",
      "content_right": "簽署白紙黑字 IP 特許授權合約：凡經 AI 推薦優化且良率/排污達標之製程，明哥享有 0.5% 季度營運成果分紅（直接撥入其退休特別帳戶），徹底化解其失業恐懼。",
      "speaker_notes": "<ul>\n    <li>開場白：「我們給明哥 0.5% 的良率排污季度分紅，還把系統命名為『明哥專家庫』。他一聽，AI 是他的學徒，達標還有錢拿，第二天他就主動交出真實數據了。」</li>\n    <li>互動提示：展示冠名後的系統 UI 設計，特別指出「明哥專利配方庫」字樣。</li>\n    <li>顧問口訣：這頁是變革管理的最高藝術——「以利益化解杯葛，以尊嚴共生技術」。</li>\n  </ul>"
    },
    {
      "page": "06",
      "layout": "dual-track",
      "progress_label": "SOLUTION",
      "title": "地端 LightGBM 配方尋優 ── 3秒生成黃金配方",
      "badge_left": "雙向尋優",
      "title_left": "預測良率與重金屬排放濃度",
      "content_left": "模型輸入端為 pH、離子濃度、操作溫度；輸出端為鹽霧良率與廢水重金屬濃度（ppm）。3秒內推薦出良率大於98.5%且排污低於環保線15%的黃金參數。",
      "badge_right": "有人在環 (HITL) 雙簽",
      "title_right": "大師傅配方簽 + 環保出站簽",
      "content_right": "黃金參數自動推薦，明哥在化驗室一鍵確認（第一簽）；廢水槽重金屬監測感測器數據由環保主管二次覆核（第二簽），雙簽始得開機，徹底阻斷環保罰單風險。",
      "speaker_notes": "<ul>\n    <li>開場白：「AI 可以在 3 秒內找到良率和排污的黃金平衡點。我們配置了『雙簽機制』，明哥第一簽，環保主管第二簽，確保出廠廢水 100% 達標。」</li>\n    <li>互動提示：用簡化流程圖演示「多變量參數尋優 -> 3秒黃金配方 -> 雙簽出站」，邏輯極度嚴密。</li>\n    <li>顧問口訣：用「有人在環」的雙簽鎖死合規邊界，防範 7% 年營收處罰。</li>\n  </ul>"
    },
    {
      "page": "07",
      "layout": "dual-track",
      "progress_label": "SOLUTION",
      "title": "歐盟 CBAM 碳排大模型對接 ── 業務快速解碼",
      "badge_left": "電鍍碳排黑盒",
      "title_left": "鋅鎳電鍍製程碳足跡向量化",
      "content_left": "歐洲車規螺絲出口面臨 CBAM 碳稅大限。電鍍製程的電費與化學藥劑碳排放折算極其複雜，傳統申報需業務部手動彙整 10 天，公式極易出錯被歐盟勒令退關。",
      "badge_right": "AI 綠色申報",
      "title_right": "10天申報工時縮短至4小時",
      "content_right": "將電鍍配方之能耗與碳排係數自動對接 RAG 稅則資料庫，3秒自動生成歐盟指定 XML 申報草稿。工時縮短至4小時，100% 通過歐盟綠色碳稅稽核，無損護航歐盟訂單。",
      "speaker_notes": "<ul>\n    <li>開場白：「這套配方系統還能順便把歐盟 CBAM 申報解了。AI 自動把電鍍能耗對接稅則庫， 3 秒生成 XML，讓業務申報從 10 天縮到 4 小時。」</li>\n    <li>互動提示：點出「這是一魚雙吃，既解決環保局罰單，又保住歐洲外銷大單」。</li>\n    <li>顧問口訣：這就是技術的「多重複利」，一次投資，雙重回收。</li>\n  </ul>"
    },
    {
      "page": "08",
      "layout": "interactive-roi",
      "progress_label": "ROI",
      "slider_min": 10,
      "slider_max": 60,
      "slider_default": 40,
      "cost_base": 1800000,
      "num_workers": 50,
      "title": "即時 ROI 模擬 ── 配方收斂與良率提升的財務回收",
      "intro_text": "拖動滑桿模擬「電鍍配方良率提升與環保罰單規避率」對年度營運利潤的直接影響。以您 50 名員工、年人均成本 NT$ 180 萬為基準，當配方良率自 94% 升至 98.8%（滑桿預設值 40% 效率提升），一年釋放的材料省廢價值、120萬罰單機會價值將當場顯示。",
      "translation_box": "【白話翻譯】我們用您自己的人力與重置成本，把「良率 98.8%」這種工程師指標，翻譯成「您今年省下多少電鍍廢料、多賺多少淨利」。拖動滑桿到 40%，出現的金額就是這套系統第一年要幫您回收的最低目標——我們把回本承諾寫進合約。",
      "speaker_notes": "<ul>\n    <li>開場白：「許總，我不跟您聊深奧的化學良率。我用您 50 個員工、180 萬人均成本，當場算給您看一年多賺多少錢。」</li>\n    <li>互動提示：讓許總本人拖動滑桿。當他看到一年省下近百萬廢料、規避 120 萬環保罰款時，數字會自己說服他。</li>\n    <li>顧問口訣：金額出來，停頓三秒，讓數字展現它的力量。然後說：「這還沒算保住車廠 IATF 資格的無價商譽。」</li>\n  </ul>"
    },
    {
      "page": "09",
      "layout": "interactive-roadmap",
      "progress_label": "PLAN",
      "title": "90 天 Quick-Win 落地路線圖 ── 配方收斂三階段",
      "speaker_notes": "<ul>\n    <li>開場白：「我們不賣『一次到位的空夢』。我們賣『第一天就讓明哥交出真實數據、90 天看得到廢水 100% 達標』的務實時程。」</li>\n    <li>互動提示：引導點擊 Month 1（特許合約簽署、地端沙盒試跑）、Month 3（試點線廢水達標良率98%以上）讓高管看到清晰的階段驗證。</li>\n    <li>顧問口訣：強調「Month 1 我們只拿 A 號電鍍槽試點，先贏一場小的。一條槽跑順了再推全廠，這是最務實的工業 AI 落地。」</li>\n  </ul>",
      "tabs": [
        {
          "name": "Month 1（信任與防線建立）",
          "content": "第一天許總與明哥正式簽署「IP 特許授權與成果分紅合約」。第一週發布「明哥專利專家配方庫」冠名，明哥老後保障與尊嚴完全鎖定。第二週本地 DLP 去識別化網閘上線，確保化學配方絕不上雲。月底地端私有 LightGBM 模型完成 20 萬組歷史 pH-良率數據的向量化，明哥主動交出真實化驗日誌。本月關鍵是建立明哥的信任。"
        },
        {
          "name": "Month 3（試點驗證期）",
          "content": "A 號電鍍槽試點線全面啟動，AI 推薦配方參數在化驗室一鍵套用，明哥與環保主管雙簽出站。電鍍良率自 94% 成功升至 98% 以上，廢水重金屬排放 100% 符合環保局法規，當月無罰單。明哥首筆良率達標提成分紅發放。利用真實數據微調模型，為全廠 6 條電鍍線橫向推廣做準備。"
        }
      ]
    },
    {
      "page": "10",
      "layout": "next-steps",
      "progress_label": "NEXT",
      "title": "下一步行動 ｜ 您今天只需要做一個決定",
      "card1_title": "Action 1 ｜ 6,800 快診結束",
      "card1_desc": "您已啟動的快診服務於今日完成。我們會在 72 小時內，將完整的快診報告（含本份建議書、IP特許授權合約草稿、DLP遮罩規範）送達您手上。這份報告您可獨立評估或諮詢第二意見。",
      "card2_title": "Action 2 ｜ 明哥專場 1 對 1",
      "card2_desc": "若您決定進入下一階段，我們提供「明哥專場」服務——孟顧問親自到廠，與明哥一對一閉門對談 90 分鐘，直接聽他的真實想法並調整特許分紅與冠名細節。費用 NT$ 18,000。這場不過明哥這關，整個專案就停在這。",
      "card3_title": "Action 3 ｜ 全額折抵變革專案",
      "card3_desc": "若明哥專場後您決定正式委託我們執行「90 天電鍍配方 AI 優化與變革管理陪跑」專案，本快診費用 NT$ 6,800 與明哥專場費用 NT$ 18,000 將 **100% 全額折抵**專案款項。您前期投入零浪費，降低決策門檻。",
      "closing_quote": "120 萬的罰單不是配方太難，是我們把掌握配方的人當成對手而非合夥人的制度迷思。把他變成合夥人，廢水就變綠了。",
      "consultants": "孟淑慧 ＆ 陳文家",
      "speaker_notes": "<ul>\n    <li>開場白：「許總，我們不要求您今天就決定整個專案。我們只請您決定『要不要見明哥一次』。」</li>\n    <li>互動提示：明確指向 Action 2 的「明哥專場」，這是這份方案的靈魂——不解開明哥的心結，買再貴的伺服器都是廢鐵。</li>\n    <li>顧問口訣：用「全額折抵」收尾——讓他覺得前期投入零風險。最後唸出金句，停頓三秒，遞名片。</li>\n  </ul>"
    }
  ]
}