{
  "client_name": "龍門冷鐓精密扣件] 高速冷鐓機崩死預警",
  "client_badge": "LUZHU_COLDHEADING GROUP",
  "logo_text": "PHOENIX AI 顧問 x [龍門冷鐓精密扣件] 高速冷鐓機崩死預警]",
  "output_dir": "slides/luzhu_coldheading",
  "theme": "obsidian-midnight",
  "audience": "internal",
  "min_slides_required": 9,
  "slides": [
    {
      "page": "01",
      "layout": "cover",
      "progress_label": "COVER",
      "title": "高速冷鐓機崩死預警與一線運維免責保護傘解決方案",
      "subtitle": "專屬 [龍門冷鐓精密扣件] [總經理 龍建國 閣下] ｜ 6,800 元前置快診建議書",
      "version": "v2026.06.01",
      "date": "2026-05-31",
      "speaker_notes": "<ul>\n    <li>開場白：「龍總，我們先定調事實——龍門的危機不是機器太笨，而是阿忠師傅覺得 AI 是抽鞭子的皮鞭。皮鞭不解，再貴的模型也只能收到作假數據。」</li>\n    <li>互動提示：封面停留 30 秒，直接切入核心痛點，展現顧問對現場人性的敏銳掌控。</li>\n    <li>顧問口訣：定錨變革主敘事——「把皮鞭轉化為保護一線的免責防彈衣」。</li>\n  </ul>"
    },
    {
      "page": "02",
      "layout": "dual-track",
      "progress_label": "DIAGNOSTIC",
      "title": "停機損失與人性阻力的惡性循環 ── 龍門冷鐓痛點會診",
      "badge_left": "顯性風險 ── 產能崩毀",
      "title_left": "高速冷鐓機瞬間卡死崩壞",
      "content_left": "沖頭與滑塊磨損不易察覺，在高溫高壓下瞬間崩死。單條產線停工 3 天拆卸維護，導致高達 NT$ 220 萬元的交期延誤賠償、重工與材料廢料損失，威脅客戶關係。",
      "badge_right": "隱性風險 ── 一線杯葛",
      "title_right": "阿忠與技術工的「電子皮鞭」恐懼",
      "content_right": "運維班長阿忠與組員強烈排斥繁瑣的平板打字操作。阿忠私下對高層極度防備，認為 AI 警報是用來監視怠工、考核扣薪的皮鞭，因而消極應對、亂打點檢結果。",
      "speaker_notes": "<ul>\n    <li>開場白：「單條產線停工 3 天，賠償 220 萬。但更致命的是，阿忠師傅因為恐懼被扣薪，故意登錄垃圾數據，讓您的 AI 系統徹底失靈。」</li>\n    <li>互動提示：在「220萬賠償」與「電子皮鞭」處加重音量，觀察總經理的表情。</li>\n    <li>顧問口訣：將「工程技術問題」直接翻譯為「利潤流失與人性抵制死結」。</li>\n  </ul>"
    },
    {
      "page": "03",
      "layout": "dual-track",
      "progress_label": "DIAGNOSTIC",
      "title": "阿忠為什麼消極作假數據？ ── 15 年運維老手的三層心結",
      "badge_left": "表面障礙 ── 物理不便",
      "title_left": "「手拿扳手滿是油污，怎麼打字？」",
      "content_left": "運維工每天在高頻震動、油污遍布的現場工作。強迫他們拿著 iPad 電腦在反光光線下點選電能波段、手動輸入聲學特徵，在現場物理環境上完全不友好。",
      "badge_right": "深層恐懼 ── 績效皮鞭",
      "title_right": "被機器監視與考核處罰的焦慮",
      "content_right": "監視恐懼：擔心警報系統成為總部高管限制休息、開單扣薪的考核枷鎖；邊緣化焦慮：擔心自己 15 年聽聲看色的獨門手藝被 AI 掏空後，面臨裁員威脅。",
      "speaker_notes": "<ul>\n    <li>開場白：「阿忠師傅不是故意跟您作對。在沒有利益與安全保護的情況下，AI 上線對他而言就是無償掠奪經驗且隨時準備裁他的刀子。他是在求生。」</li>\n    <li>互動提示：引導龍總換位思考，理解老臣抗拒的內在合理性。</li>\n    <li>顧問口訣：變革管理的智慧——「給足安全感，阻力變推力」。</li>\n  </ul>"
    },
    {
      "page": "04",
      "layout": "dual-track",
      "progress_label": "SOLUTION",
      "title": "機電運維免責保護傘 ── 讓 AI 成為老臣的防彈衣",
      "badge_left": "舊有考核 ── 越防越假",
      "title_left": "異常追責與消極隱瞞",
      "content_left": "傳統制度下，設備崩死直接追究運維工點檢不力，導致工人消極對待系統、故意偽造數據，AI POC 因缺乏真實數據而在半年內夭折。",
      "badge_right": "免責保護傘 ── 利益對齊",
      "title_right": "提前預警一律免責與防錯獎金",
      "content_right": "正式發布合規辦法：凡經 AI 提前 2 小時發出預警的異常機台，一線運維人員一律免除考核責任！設立「AI 預警精準排除獎金」，將阿忠升任為首席標記專家。",
      "speaker_notes": "<ul>\n    <li>開場白：「我們要把皮鞭變成防彈衣。凡是 AI 提前 2 小時預警的，後續不管怎麼壞，運維工一律免責！責任由公司折舊與保險承擔。這樣阿忠會搶著配合系統。」</li>\n    <li>互動提示：用肯定的手勢強調「一律免責」，這能瞬間瓦解一線的防備。</li>\n    <li>顧問口訣：用「免責」換「真數據」，這是 B2B AI 落地最划算的交易。</li>\n  </ul>"
    },
    {
      "page": "05",
      "layout": "dual-track",
      "progress_label": "SOLUTION",
      "title": "一鍵式紅綠燈防呆 UI ── 徹底消除打字屏障",
      "badge_left": "過去操作 ── 繁瑣平板",
      "title_left": "iPad 打字與數據填寫障礙",
      "content_left": "舊有系統要求在平板上登錄複雜的電能波形與聲波特徵，工人手拿扳手根本無法操作，導致系統形同虛設，數據嚴重損缺。",
      "badge_right": "極簡 UI ── 物理一鍵",
      "title_right": "三色紅綠燈螢幕與一鍵語音確認",
      "content_right": "每台冷鐓機旁加裝 7 吋紅綠燈螢幕。黃燈預警時，阿忠微調完畢只需用油污大拇指按壓「物理黃色按鈕」，Voice AI 自動記錄口頭報工，雙手完全不用碰螢幕。",
      "speaker_notes": "<ul>\n    <li>開場白：「我們把平板扔掉。冷鐓機旁就放紅綠燈跟一個物理大按鈕。黃燈亮，阿忠扳手轉兩下，大油拇指一按按鈕，語音自動報工完畢，他全程不用打一個字。」</li>\n    <li>互動提示：演示按壓物理按鈕的動作，強調這對現場黑手師傅的物理友好度。</li>\n    <li>顧問口訣：高級的工業設計——「極簡即是安全，防呆即是效率」。</li>\n  </ul>"
    },
    {
      "page": "06",
      "layout": "dual-track",
      "progress_label": "SOLUTION",
      "title": "樹莓派離線分析 ── 10ms 機電實體熔斷防禦",
      "badge_left": "電磁與斷網痛點",
      "title_left": "雲端斷訊與起火責任真空",
      "content_left": "扣件廠房高震動、高電磁干擾，網路極易瞬時斷訊。一旦依賴雲端的 AI 模型斷訊，將發生預警真空，瞬間崩死停機仍會引發重大起火索賠。",
      "badge_right": "地端樹莓派 ── 硬熔斷",
      "title_right": "離線 CNN 模型與 10ms 馬達斷電",
      "content_right": "部署「工業級樹莓派離線隔離節點CM4」，CNN-XGBoost 模型 100% 地端運行。檢測到崩損臨界點，10ms 內觸發實體繼電器彈開，切斷馬達電源，物理保護機組。",
      "speaker_notes": "<ul>\n    <li>開場白：「廠房高干擾、易斷網。我們用本地輕量化樹莓派離線分析，無網也能提前 2 小時報警。一旦到瀕死臨界點，10毫秒彈開繼電器，物理斷電保護，絕不起火。」</li>\n    <li>互動提示：點擊樹莓派地端與實體繼電器的聯動圖解，展現技術防線的硬派特徵。</li>\n    <li>顧問口訣：工業安控的終極鐵律——「雲端出謀劃策，地端物理保命」。</li>\n  </ul>"
    },
    {
      "page": "07",
      "layout": "interactive-roi",
      "progress_label": "ROI",
      "slider_min": 10,
      "slider_max": 60,
      "slider_default": 40,
      "cost_base": 1800000,
      "num_workers": 50,
      "title": "即時 ROI 模擬 ── 設備崩損降低的利潤回收",
      "intro_text": "拖動滑桿模擬「冷鍛機崩死停機率降低與運維防錯效率提升」對年度利潤的直接影響。以您 50 名員工、年人均成本 NT$ 180 萬為基準，當 AI 預警配合度與精準度提升至 40%（滑桿預設值），一年省下的停機維修天數、220萬延誤賠償與重工損失將當場顯示。",
      "translation_box": "【白話翻譯】我們用您自己的人力重置與停工機會損失，把 AI 聲學預測率翻譯成公司省下的實體利潤。拖動滑桿到 40%，出現的金額就是這套系統第一年要幫您回收的最低目標——我們把回本承諾直接寫進專案合約中。",
      "speaker_notes": "<ul>\n    <li>開場白：「龍總，我不跟您講微積分或聲學特徵的數學模型。我直接用您現場運維重置成本，算給您看第一年省下多少利潤。」</li>\n    <li>互動提示：引導總經理本人拖動滑桿。當他看到滑動到 40% 能省下百萬損失時，數字會自己展現說服力。</li>\n    <li>顧問口訣：金額跳出，停頓三秒。然後說：「這還沒算保住大客戶外銷交期承諾的商譽價值。」</li>\n  </ul>"
    },
    {
      "page": "08",
      "layout": "interactive-roadmap",
      "progress_label": "PLAN",
      "title": "90 天 Quick-Win 落地路線圖 ── 龍門冷鐓三階段",
      "speaker_notes": "<ul>\n    <li>開場白：「我們不搞兩年的大型重構。我們用 90 天，第一天解除阿忠心魔，第 90 天讓 32 台高速冷鐓機全部綠燈預警。」</li>\n    <li>互動提示：引導點擊 Month 1（制度建立、免責合約簽署）、Month 3（A車間5台高速冷鐓機試點運行）、Month 6（全廠32台冷鐓機全面推廣）讓高管看到清晰的階段驗證。</li>\n    <li>顧問口訣：強調「Month 1 我們只拿 A 車間 5 台高速冷鐓機試點，先贏一場小的。這是務實顧問的鐵律。」</li>\n  </ul>",
      "tabs": [
        {
          "name": "Month 1（免責防線與認同）",
          "content": "龍總代表公司與阿忠師傅正式簽署「技術入股與季度防錯成果分紅合約」。發布全廠「機電運維免責保護傘」合規政策。升任阿忠為「龍門冷鐓 AI 聲學標記首席專家教練」，阿忠老臣尊嚴與安全完全鎖定。安裝第一套指向性防磁麥克風，一鍵式紅綠燈防呆按鈕 UI 於換模車間試上線，雙手完全不碰螢幕。月底本月關鍵是完全解除一線運維人員的敵意。"
        },
        {
          "name": "Month 3（A車間 5 台試點驗證）",
          "content": "A車間 5 台高速冷鐓機試點全面啟動，工業級樹莓派地端隔離節點 CM4 運行 CNN-XGBoost 磨損預估模型。實體繼電器硬熔斷器部署完畢，10ms 內成功防禦一次主滑塊瞬間卡死崩死異常，當月廢料與交期機會損失降低 80% 以上。每週開試點優化會，由阿忠教練主持並分享 AI 糾錯成果。利用試點數據持續優化地端聲學波譜，準備橫向推廣。"
        }
      ]
    },
    {
      "page": "09",
      "layout": "next-steps",
      "progress_label": "NEXT",
      "title": "下一步行動 ｜ 您今天只需要做一個決定",
      "card1_title": "Action 1 ｜ 6,800 快診結束",
      "card1_desc": "您已啟動的快診服務於今日完成。我們會在 72 小時內，將完整的快診報告（含本份建議書、技術股權合約草案、語音報工與樹莓派硬體規格）送達您手上。這份報告您可獨立評估或諮詢第二意見。",
      "card2_title": "Action 2 ｜ 阿忠專場 1 對 1",
      "card2_desc": "若您決定進入下一階段，我們提供「阿忠專場」服務——孟顧問親自到廠，與運維班長阿忠一對一閉門會診 90 分鐘，直接聽他的真實想法並調整免責與冠名細節。費用 NT$ 18,000。這場不過阿忠這關，整個專案就停在這。",
      "card3_title": "Action 3 ｜ 全額折抵陪跑專案",
      "card3_desc": "若阿忠專場後您決定正式委託我們執行「90 天冷鐓 AI 預警與變革管理陪跑」專案，本快診費用 NT$ 6,800 與阿忠專場費用 NT$ 18,000 將 **100% 全額折抵**專案款項。您前期投入零浪費，降低決策門檻。",
      "closing_quote": "AI 預警警報不是監視工人的電子皮鞭，而是給他們抵禦崩刀責任的防彈衣。把防彈衣穿上，機器就不會崩了。",
      "consultants": "孟淑慧 ＆ 陳文家",
      "speaker_notes": "<ul>\n    <li>開場白：「龍總，我們不要求您今天就決定整個專案。我們只請您決定『要不要見阿忠一次』。」</li>\n    <li>互動提示：明確指向 Action 2 的「阿忠專場」，這是這份方案的靈魂——不解開阿忠的心結，買再貴的感測器都是廢鐵。</li>\n    <li>顧問口訣：用「全額折抵」收尾——讓他覺得前期投入零風險。最後唸出金句，停頓三秒，遞名片。</li>\n  </ul>"
    }
  ]
}